{
  "binding_profile": {
    "factory": "materialize_binding_profile",
    "kwargs": {
      "dataflow_version": "dataflow/0",
      "max_fact_requirements_per_query": 4,
      "max_queries": 8,
      "rule_set_version": "rules/lr-test/1"
    }
  },
  "equivalence_pairs": [
    {
      "comparison": "full_result_bytes",
      "id": "equivalence:permutation-full-result",
      "left_success_case_ref": "success:permutation-left",
      "right_success_case_ref": "success:permutation-right"
    },
    {
      "comparison": "command_bytes",
      "id": "equivalence:clean-process-command",
      "left_success_case_ref": "success:eligible-golden",
      "right_success_case_ref": "success:eligible-golden"
    }
  ],
  "goldens": [
    {
      "id": "golden:eligible-projection",
      "kind": "LRProjectionResult",
      "path": "fixtures/lr-seam/golden/eligible.projection.json"
    },
    {
      "id": "golden:mismatch-rejection",
      "kind": "LRProjectionRejection",
      "path": "fixtures/lr-seam/golden/mismatch.rejection.json"
    }
  ],
  "l_results": {
    "actual-m1-chain": {
      "fact_delta_set": "m1-observe-with-effect",
      "factory": "solve_l",
      "logical_time": 1,
      "prior_materialization": null,
      "rule_bundle_ref": "actual-m1-chain"
    },
    "truth-four": {
      "fact_delta_set": "truth-four-supports",
      "factory": "solve_l",
      "logical_time": 7,
      "prior_materialization": null,
      "rule_bundle_ref": "truth-four"
    }
  },
  "query_batches": {
    "actual-chain": {
      "fact_precondition_ids": [
        "constraint:artifact-ready"
      ],
      "factory": "m1_chain",
      "frontier_precondition_ids": [
        "frontier:1"
      ]
    },
    "eligible-golden": {
      "factory": "eligible_golden",
      "truth_cases": [
        "positive_TRUE_ONLY"
      ]
    },
    "empty": {
      "factory": "empty_query_batch",
      "truth_cases": []
    },
    "limit-n": {
      "count": 8,
      "factory": "query_limit"
    },
    "multi-aggregation": {
      "factory": "multi_aggregation",
      "truth_cases": [
        "positive_TRUE_ONLY+negative_FALSE_ONLY",
        "positive_TRUE_ONLY+positive_BOTH"
      ]
    },
    "permutation-left": {
      "factory": "permutation",
      "variant": "canonical"
    },
    "permutation-right": {
      "factory": "permutation",
      "variant": "reversed_queries_requirements_and_nested_sets"
    },
    "truth-matrix": {
      "factory": "truth_matrix",
      "truth_cases": [
        "positive_TRUE_ONLY",
        "positive_FALSE_ONLY",
        "positive_BOTH",
        "positive_NEITHER",
        "negative_TRUE_ONLY",
        "negative_FALSE_ONLY"
      ]
    }
  },
  "r_profile": {
    "factory": "materialize_r_profile",
    "kwargs": {
      "dataflow_version": "dataflow/0",
      "max_deltas_per_command": 32
    }
  },
  "rejection_cases": [
    {
      "expected": {
        "binding_profile_digest": "sha256:588304ac00d3d30a7466ec8c3928acbcccc0af16c15c05ed89990a60411bc3b3",
        "code": "PRECONDITION_BINDING_MISMATCH",
        "context": {
          "invariant": "exact_precondition_partition",
          "proposal_id": "proposal:lr:orphan"
        },
        "contract_version": "flrh-lr-seam/1",
        "kind": "LRProjectionRejection",
        "l_fixpoint_digest": "sha256:e16dfadc7828dad76193597a8512d752058eae9f217f2b9492208afd1618af90",
        "logical_time": 7,
        "path": "/query_batch/queries/0",
        "query_batch_digest": null,
        "r_profile_digest": "sha256:19f7a4bc9f04b7302f99df908b2f4d5abf1d632104cdee64140a068892bd64c4",
        "schema_version": "flrh-lr-result/1"
      },
      "id": "reject:orphan-precondition",
      "mutation": "orphan_precondition"
    },
    {
      "expected": {
        "binding_profile_digest": "sha256:588304ac00d3d30a7466ec8c3928acbcccc0af16c15c05ed89990a60411bc3b3",
        "code": "PRECONDITION_BINDING_MISMATCH",
        "context": {
          "invariant": "disjoint_precondition_bindings",
          "proposal_id": "proposal:lr:overlap"
        },
        "contract_version": "flrh-lr-seam/1",
        "kind": "LRProjectionRejection",
        "l_fixpoint_digest": "sha256:e16dfadc7828dad76193597a8512d752058eae9f217f2b9492208afd1618af90",
        "logical_time": 7,
        "path": "/query_batch/queries/0",
        "query_batch_digest": null,
        "r_profile_digest": "sha256:19f7a4bc9f04b7302f99df908b2f4d5abf1d632104cdee64140a068892bd64c4",
        "schema_version": "flrh-lr-result/1"
      },
      "id": "reject:overlap-precondition",
      "mutation": "fact_frontier_overlap"
    },
    {
      "expected": {
        "binding_profile_digest": "sha256:588304ac00d3d30a7466ec8c3928acbcccc0af16c15c05ed89990a60411bc3b3",
        "code": "PRECONDITION_BINDING_MISMATCH",
        "context": {
          "invariant": "unique_fact_precondition_id",
          "proposal_id": "proposal:lr:duplicate-binding"
        },
        "contract_version": "flrh-lr-seam/1",
        "kind": "LRProjectionRejection",
        "l_fixpoint_digest": "sha256:e16dfadc7828dad76193597a8512d752058eae9f217f2b9492208afd1618af90",
        "logical_time": 7,
        "path": "/query_batch/queries/0/fact_requirements",
        "query_batch_digest": null,
        "r_profile_digest": "sha256:19f7a4bc9f04b7302f99df908b2f4d5abf1d632104cdee64140a068892bd64c4",
        "schema_version": "flrh-lr-result/1"
      },
      "id": "reject:duplicate-precondition",
      "mutation": "duplicate_requirement_precondition"
    },
    {
      "expected": {
        "binding_profile_digest": "sha256:588304ac00d3d30a7466ec8c3928acbcccc0af16c15c05ed89990a60411bc3b3",
        "code": "QUERY_ATOM_NOT_DECLARED",
        "context": {
          "precondition_id": "precondition:undeclared",
          "proposal_id": "proposal:lr:undeclared"
        },
        "contract_version": "flrh-lr-seam/1",
        "kind": "LRProjectionRejection",
        "l_fixpoint_digest": "sha256:e16dfadc7828dad76193597a8512d752058eae9f217f2b9492208afd1618af90",
        "logical_time": 7,
        "path": "/query_batch/queries/0/fact_requirements/0/literal/atom",
        "query_batch_digest": null,
        "r_profile_digest": "sha256:19f7a4bc9f04b7302f99df908b2f4d5abf1d632104cdee64140a068892bd64c4",
        "schema_version": "flrh-lr-result/1"
      },
      "id": "reject:undeclared-query-atom",
      "mutation": "undeclared_query_atom"
    },
    {
      "expected": {
        "binding_profile_digest": "sha256:588304ac00d3d30a7466ec8c3928acbcccc0af16c15c05ed89990a60411bc3b3",
        "code": "DIGEST_MISMATCH",
        "context": {
          "actual": "sha256:0000000000000000000000000000000000000000000000000000000000000000",
          "expected": "sha256:a34c99f81ff91696492b1584d1264c5e9f7200b76168c86a0360d99be64f58bd"
        },
        "contract_version": "flrh-lr-seam/1",
        "kind": "LRProjectionRejection",
        "l_fixpoint_digest": "sha256:e16dfadc7828dad76193597a8512d752058eae9f217f2b9492208afd1618af90",
        "logical_time": 7,
        "path": "/query_batch/query_batch_digest",
        "query_batch_digest": null,
        "r_profile_digest": "sha256:19f7a4bc9f04b7302f99df908b2f4d5abf1d632104cdee64140a068892bd64c4",
        "schema_version": "flrh-lr-result/1"
      },
      "id": "reject:query-batch-digest",
      "mutation": "query_batch_digest_flip"
    },
    {
      "expected": {
        "binding_profile_digest": "sha256:588304ac00d3d30a7466ec8c3928acbcccc0af16c15c05ed89990a60411bc3b3",
        "code": "VERSION_MISMATCH",
        "context": {
          "actual": "rules/wrong/1",
          "expected": "rules/lr-test/1",
          "proposal_id": "proposal:lr:version"
        },
        "contract_version": "flrh-lr-seam/1",
        "kind": "LRProjectionRejection",
        "l_fixpoint_digest": "sha256:e16dfadc7828dad76193597a8512d752058eae9f217f2b9492208afd1618af90",
        "logical_time": 7,
        "path": "/query_batch/queries/0/proposal/versions/rule_set",
        "query_batch_digest": null,
        "r_profile_digest": "sha256:19f7a4bc9f04b7302f99df908b2f4d5abf1d632104cdee64140a068892bd64c4",
        "schema_version": "flrh-lr-result/1"
      },
      "id": "reject:proposal-rule-version",
      "mutation": "proposal_rule_version_mismatch"
    },
    {
      "expected": {
        "binding_profile_digest": "sha256:588304ac00d3d30a7466ec8c3928acbcccc0af16c15c05ed89990a60411bc3b3",
        "code": "DUPLICATE_PROPOSAL",
        "context": {
          "proposal_id": "proposal:lr:duplicate-proposal"
        },
        "contract_version": "flrh-lr-seam/1",
        "kind": "LRProjectionRejection",
        "l_fixpoint_digest": "sha256:e16dfadc7828dad76193597a8512d752058eae9f217f2b9492208afd1618af90",
        "logical_time": 7,
        "path": "/query_batch/queries/1/proposal/proposal_id",
        "query_batch_digest": null,
        "r_profile_digest": "sha256:19f7a4bc9f04b7302f99df908b2f4d5abf1d632104cdee64140a068892bd64c4",
        "schema_version": "flrh-lr-result/1"
      },
      "id": "reject:duplicate-proposal",
      "mutation": "duplicate_proposal_id"
    },
    {
      "expected": {
        "binding_profile_digest": "sha256:588304ac00d3d30a7466ec8c3928acbcccc0af16c15c05ed89990a60411bc3b3",
        "code": "LIMIT_EXCEEDED",
        "context": {
          "limit": 8,
          "observed": 9
        },
        "contract_version": "flrh-lr-seam/1",
        "kind": "LRProjectionRejection",
        "l_fixpoint_digest": "sha256:e16dfadc7828dad76193597a8512d752058eae9f217f2b9492208afd1618af90",
        "logical_time": 7,
        "path": "/query_batch/queries",
        "query_batch_digest": null,
        "r_profile_digest": "sha256:19f7a4bc9f04b7302f99df908b2f4d5abf1d632104cdee64140a068892bd64c4",
        "schema_version": "flrh-lr-result/1"
      },
      "id": "reject:max-queries-n-plus-one",
      "mutation": "max_queries_plus_one"
    },
    {
      "expected": {